{
  "artefakt_id": "A05",
  "projekt_id": "MA-20261003-001",
  "version": "0.1.0",
  "datum": "2026-10-03",
  "autor": "[Verantwortliche Person eintragen.]",
  "status": "Entwurf",
  "eingaben": [],
  "quellen": [],
  "offene_punkte": [
    "Beispielvorlage vollständig bearbeiten; fehlende Nachweise sind keine Freigabe."
  ],
  "gesperrt": false,
  "sperrgrund": "",
  "beispiel": true,
  "inhalt": {
    "saetze": [
      {
        "satz_id": "S01",
        "text": "[Sprechertext erst nach Recherche und Claim-Prüfung einfügen.]",
        "faktisch": false,
        "claim_ids": [],
        "funktion": "kontext"
      }
    ],
    "sprechertext": "[Sprechertext erst nach Recherche und Claim-Prüfung einfügen.]",
    "wortzahl": 7,
    "untertitel_basis": "[Sprechertext erst nach Recherche und Claim-Prüfung einfügen.]",
    "aussprache": [],
    "overlays": [],
    "titel": {
      "text": "[Belegten und klar begrenzten Titel formulieren.]",
      "faktisch": false,
      "claim_ids": []
    },
    "thumbnail": {
      "text": "[Thumbnailtext ohne Übertreibung eintragen.]",
      "faktisch": false,
      "claim_ids": []
    },
    "beschreibung": {
      "text": "[Beschreibung und Gültigkeitsgrenzen eintragen.]",
      "faktisch": false,
      "claim_ids": []
    },
    "quellenangaben": [],
    "cta": {
      "text": "[Sachlichen nächsten Schritt für Zuschauer formulieren.]",
      "faktisch": false,
      "claim_ids": []
    },
    "disclaimer": "Journalistischer Analyse-Content. Kein medizinischer Rat.",
    "hashtags": []
  }
}
